{
 "name": "tool-result-scalar-shape",
 "family": "agent",
 "authority": "pinned Pi b7bb00b9 agent-loop.ts executeToolCalls/executeToolCallsSequential .. emitToolResultMessage (sliced, toolExecution sequential; a custom tool + afterToolCall) + coding-agent session-manager.ts `${JSON.stringify(entry)}\\n` / parseSessionEntries, under Node 22.15.1 (L0506-D003 result-domain probe)",
 "pi_revision": "b7bb00b936dbe21b8e160b3e89efdec361846699",
 "requirements": [
  "AI-006",
  "TOOL-005",
  "TOOL-017",
  "MINION-002"
 ],
 "witnesses": [
  "tool_result_runtime_value_domain"
 ],
 "notes": "null/true/false as leaves; true/false as the whole top-level details; empty object and array. Absent/undefined details and a top-level null are excluded (ADJ-2: certified IR-L06-004 host mapping, not folded). GENERATED from the pinned-Pi L0506-D003 probe; regenerate with harness/make_scenarios.py.",
 "tool_result_domain": {
  "cases": [
   {
    "id": "details-scalar/null",
    "tool": {
     "returns": {
      "content": [
       {
        "utf16": [
         111,
         107
        ]
       }
      ],
      "details": {
       "$keys": [
        [
         [
          118,
          97,
          108,
          117,
          101
         ],
         null
        ]
       ]
      }
     }
    },
    "hook": {
     "mode": "none"
    },
    "expect": {
     "hook": null,
     "execution_end": {
      "content": [
       {
        "utf16": [
         111,
         107
        ]
       }
      ],
      "details": {
       "$keys": [
        [
         [
          118,
          97,
          108,
          117,
          101
         ],
         null
        ]
       ]
      },
      "is_error": false
     },
     "message": {
      "content": [
       {
        "utf16": [
         111,
         107
        ]
       }
      ],
      "details": {
       "$keys": [
        [
         [
          118,
          97,
          108,
          117,
          101
         ],
         null
        ]
       ]
      },
      "is_error": false
     },
     "session": {
      "content": [
       {
        "utf16": [
         111,
         107
        ]
       }
      ],
      "details": {
       "$keys": [
        [
         [
          118,
          97,
          108,
          117,
          101
         ],
         null
        ]
       ]
      }
     }
    },
    "pi_session_file": {
     "line_utf8_hex": "7b2274797065223a226d657373616765222c226964223a226531222c22706172656e744964223a6e756c6c2c2274696d657374616d70223a2274222c226d657373616765223a7b22726f6c65223a22746f6f6c526573756c74222c22746f6f6c43616c6c4964223a2263616c6c2d31222c22746f6f6c4e616d65223a2270726f6265222c22636f6e74656e74223a5b7b2274797065223a2274657874222c2274657874223a226f6b227d5d2c2264657461696c73223a7b2276616c7565223a6e756c6c7d2c2269734572726f72223a66616c73652c2274696d657374616d70223a307d7d0a",
     "reload": {
      "content": [
       {
        "utf16": [
         111,
         107
        ]
       }
      ],
      "details": {
       "$keys": [
        [
         [
          118,
          97,
          108,
          117,
          101
         ],
         null
        ]
       ]
      }
     }
    }
   },
   {
    "id": "details-scalar/true",
    "tool": {
     "returns": {
      "content": [
       {
        "utf16": [
         111,
         107
        ]
       }
      ],
      "details": {
       "$keys": [
        [
         [
          118,
          97,
          108,
          117,
          101
         ],
         true
        ]
       ]
      }
     }
    },
    "hook": {
     "mode": "none"
    },
    "expect": {
     "hook": null,
     "execution_end": {
      "content": [
       {
        "utf16": [
         111,
         107
        ]
       }
      ],
      "details": {
       "$keys": [
        [
         [
          118,
          97,
          108,
          117,
          101
         ],
         true
        ]
       ]
      },
      "is_error": false
     },
     "message": {
      "content": [
       {
        "utf16": [
         111,
         107
        ]
       }
      ],
      "details": {
       "$keys": [
        [
         [
          118,
          97,
          108,
          117,
          101
         ],
         true
        ]
       ]
      },
      "is_error": false
     },
     "session": {
      "content": [
       {
        "utf16": [
         111,
         107
        ]
       }
      ],
      "details": {
       "$keys": [
        [
         [
          118,
          97,
          108,
          117,
          101
         ],
         true
        ]
       ]
      }
     }
    },
    "pi_session_file": {
     "line_utf8_hex": "7b2274797065223a226d657373616765222c226964223a226531222c22706172656e744964223a6e756c6c2c2274696d657374616d70223a2274222c226d657373616765223a7b22726f6c65223a22746f6f6c526573756c74222c22746f6f6c43616c6c4964223a2263616c6c2d31222c22746f6f6c4e616d65223a2270726f6265222c22636f6e74656e74223a5b7b2274797065223a2274657874222c2274657874223a226f6b227d5d2c2264657461696c73223a7b2276616c7565223a747275657d2c2269734572726f72223a66616c73652c2274696d657374616d70223a307d7d0a",
     "reload": {
      "content": [
       {
        "utf16": [
         111,
         107
        ]
       }
      ],
      "details": {
       "$keys": [
        [
         [
          118,
          97,
          108,
          117,
          101
         ],
         true
        ]
       ]
      }
     }
    }
   },
   {
    "id": "details-top-scalar/true",
    "tool": {
     "returns": {
      "content": [
       {
        "utf16": [
         111,
         107
        ]
       }
      ],
      "details": true
     }
    },
    "hook": {
     "mode": "none"
    },
    "expect": {
     "hook": null,
     "execution_end": {
      "content": [
       {
        "utf16": [
         111,
         107
        ]
       }
      ],
      "details": true,
      "is_error": false
     },
     "message": {
      "content": [
       {
        "utf16": [
         111,
         107
        ]
       }
      ],
      "details": true,
      "is_error": false
     },
     "session": {
      "content": [
       {
        "utf16": [
         111,
         107
        ]
       }
      ],
      "details": true
     }
    },
    "pi_session_file": {
     "line_utf8_hex": "7b2274797065223a226d657373616765222c226964223a226531222c22706172656e744964223a6e756c6c2c2274696d657374616d70223a2274222c226d657373616765223a7b22726f6c65223a22746f6f6c526573756c74222c22746f6f6c43616c6c4964223a2263616c6c2d31222c22746f6f6c4e616d65223a2270726f6265222c22636f6e74656e74223a5b7b2274797065223a2274657874222c2274657874223a226f6b227d5d2c2264657461696c73223a747275652c2269734572726f72223a66616c73652c2274696d657374616d70223a307d7d0a",
     "reload": {
      "content": [
       {
        "utf16": [
         111,
         107
        ]
       }
      ],
      "details": true
     }
    }
   },
   {
    "id": "details-scalar/false",
    "tool": {
     "returns": {
      "content": [
       {
        "utf16": [
         111,
         107
        ]
       }
      ],
      "details": {
       "$keys": [
        [
         [
          118,
          97,
          108,
          117,
          101
         ],
         false
        ]
       ]
      }
     }
    },
    "hook": {
     "mode": "none"
    },
    "expect": {
     "hook": null,
     "execution_end": {
      "content": [
       {
        "utf16": [
         111,
         107
        ]
       }
      ],
      "details": {
       "$keys": [
        [
         [
          118,
          97,
          108,
          117,
          101
         ],
         false
        ]
       ]
      },
      "is_error": false
     },
     "message": {
      "content": [
       {
        "utf16": [
         111,
         107
        ]
       }
      ],
      "details": {
       "$keys": [
        [
         [
          118,
          97,
          108,
          117,
          101
         ],
         false
        ]
       ]
      },
      "is_error": false
     },
     "session": {
      "content": [
       {
        "utf16": [
         111,
         107
        ]
       }
      ],
      "details": {
       "$keys": [
        [
         [
          118,
          97,
          108,
          117,
          101
         ],
         false
        ]
       ]
      }
     }
    },
    "pi_session_file": {
     "line_utf8_hex": "7b2274797065223a226d657373616765222c226964223a226531222c22706172656e744964223a6e756c6c2c2274696d657374616d70223a2274222c226d657373616765223a7b22726f6c65223a22746f6f6c526573756c74222c22746f6f6c43616c6c4964223a2263616c6c2d31222c22746f6f6c4e616d65223a2270726f6265222c22636f6e74656e74223a5b7b2274797065223a2274657874222c2274657874223a226f6b227d5d2c2264657461696c73223a7b2276616c7565223a66616c73657d2c2269734572726f72223a66616c73652c2274696d657374616d70223a307d7d0a",
     "reload": {
      "content": [
       {
        "utf16": [
         111,
         107
        ]
       }
      ],
      "details": {
       "$keys": [
        [
         [
          118,
          97,
          108,
          117,
          101
         ],
         false
        ]
       ]
      }
     }
    }
   },
   {
    "id": "details-top-scalar/false",
    "tool": {
     "returns": {
      "content": [
       {
        "utf16": [
         111,
         107
        ]
       }
      ],
      "details": false
     }
    },
    "hook": {
     "mode": "none"
    },
    "expect": {
     "hook": null,
     "execution_end": {
      "content": [
       {
        "utf16": [
         111,
         107
        ]
       }
      ],
      "details": false,
      "is_error": false
     },
     "message": {
      "content": [
       {
        "utf16": [
         111,
         107
        ]
       }
      ],
      "details": false,
      "is_error": false
     },
     "session": {
      "content": [
       {
        "utf16": [
         111,
         107
        ]
       }
      ],